{
  "$schema": "https://json-schema.org/draft/2020-12/schema",
  "$id": "https://raw.githubusercontent.com/edynasty/LumenCortex/main/docs/lumencortex.schema.json",
  "title": "LumenCortex configuration",
  "description": "One file format for the global catalog (~/.config/lumencortex/lumencortex.json) and the workspace override (<workspace>/lumencortex.json), read by core and edited by Desktop. Unknown keys are rejected.",
  "type": "object",
  "additionalProperties": false,
  "properties": {
    "$schema": {
      "description": "Editor hint only; core ignores the value.",
      "type": "string"
    },
    "model": {
      "description": "Default model for new sessions as provider/model; resolved against providers after the workspace file is merged over the global file.",
      "$ref": "#/$defs/modelRef"
    },
    "failover": {
      "description": "Model refs tried, in order, after the session model within one request. Availability errors (408, 409, 429, 5xx, transport errors, idle timeout) move to the next entry; a context-length error moves only to an entry with a larger limit.context; auth and other 4xx errors never move. Models without tool calling or too small for the request are skipped. Absent → no failover.",
      "type": "array",
      "items": { "$ref": "#/$defs/modelRef" },
      "uniqueItems": true,
      "maxItems": 8
    },
    "effort": {
      "description": "Reasoning effort policy. Absent → no reasoning parameter is sent (provider default) and no escalation.",
      "dependentRequired": { "escalation": ["default"] },
      "type": "object",
      "additionalProperties": false,
      "properties": {
        "default": {
          "description": "Effort requested on every request unless the user overrides it for a run. Absent → no reasoning parameter is sent (provider default). \"auto\" resolves one concrete level per user turn from effort.auto before the first request; the resolved level is that run's default and escalation still raises it. Per model the request is raised to the lowest level listed in reasoning.efforts that is not below it (the highest listed level if none is), then encoded by reasoning.format.",
          "$ref": "#/$defs/effortRequest"
        },
        "auto": {
          "description": "Auto effort resolver, used when effort.default or a run's effort is \"auto\". A judge model classifies each user turn (new input plus the previous request and last reply, truncated) into none|low|medium|high|max; a judge failure, timeout, unusable answer or absent model falls back to a deterministic heuristic. The result is capped at max, then fitted to each candidate's reasoning.efforts; a candidate whose list offers nothing at or below max sends no reasoning parameter (rule effort.auto_unavailable).",
          "type": "object",
          "additionalProperties": false,
          "properties": {
            "model": {
              "description": "Judge model as provider/model. Absent → the heuristic classifier only. The judge call is one non-streaming request with no tools; it is not added to the transcript.",
              "$ref": "#/$defs/modelRef"
            },
            "max": {
              "description": "Ceiling for the classified level. Absent → high.",
              "$ref": "#/$defs/effort"
            },
            "timeoutSeconds": {
              "description": "Bound on one judge request. Absent → 8.",
              "type": "integer",
              "minimum": 1,
              "maximum": 60
            }
          }
        },
        "escalation": {
          "description": "Raise effort while the run is stuck. Absent → escalation disabled. Requires default.",
          "type": "object",
          "additionalProperties": false,
          "required": ["sameFailure", "noProgressSteps", "max"],
          "properties": {
            "sameFailure": {
              "description": "One level up when the latest tool failure signature (tool name + normalized output) has occurred this many times in the session; two levels at twice the count. Counters reset when a work unit completes or a required check passes.",
              "type": "integer",
              "minimum": 1,
              "maximum": 20
            },
            "noProgressSteps": {
              "description": "One level up after this many consecutive failed tool results (any successful tool result resets the count); two levels at twice the count.",
              "type": "integer",
              "minimum": 1,
              "maximum": 50
            },
            "max": {
              "description": "Upper bound for escalated effort. Escalation never goes below default.",
              "$ref": "#/$defs/effort"
            }
          }
        }
      }
    },
    "agents": {
      "description": "Agent catalog (ADR-0009). An agent is a named run preset: instructions, an ordered list of model candidates with their effort, and an authority ceiling. Built-ins: ask (conversation, read-only, no delegation), agent (conversation, the default, no cap), explore (spawn_subagent default, read-only) and worker (start_task default, workspace); a built-in accepts only instructions, effort and models. Up to 16 custom agents. A trusted workspace may add or replace custom agents and override built-ins; any other workspace may set only models and effort of an existing agent, to models of global providers.",
      "type": "object",
      "propertyNames": { "pattern": "^[a-z][a-z0-9-]{0,39}$" },
      "maxProperties": 20,
      "additionalProperties": { "$ref": "#/$defs/agent" }
    },
    "concurrency": {
      "description": "Agent concurrency of one LumenCortex process. Read from the global file only (ignored with a warning in a workspace file): it bounds the machine's resources, not one project's. Read at every run start, so a change applies to the next run; running agents are never stopped by a lower limit. A start beyond a limit is refused at once, never queued.",
      "type": "object",
      "additionalProperties": false,
      "properties": {
        "maxAgents": {
          "description": "Agent runs executing at once in this process: conversation threads and their child agents together. Absent → 4.",
          "type": "integer",
          "minimum": 1,
          "maximum": 16
        },
        "maxChildrenPerParent": {
          "description": "Child agents (read-only subagents and execution tasks together) one session may have running at once. Children also count against maxAgents. Absent → 3.",
          "type": "integer",
          "minimum": 1,
          "maximum": 8
        }
      }
    },
    "providers": {
      "description": "Provider catalog keyed by provider id (the part before '/' in a model ref). In a workspace file this key is honoured only when the workspace is listed in the global trustedWorkspaces; entries then merge field by field over the global entry with the same id, and an entry that changes a global provider's baseURL or endpoint must set its own apiKey. Untrusted workspace entries are ignored with a warning.",
      "type": "object",
      "propertyNames": { "pattern": "^[^/\\s]+$" },
      "additionalProperties": { "$ref": "#/$defs/provider" }
    },
    "checks": {
      "description": "Evaluator checks keyed by check id; core runs them and records eval_results with provenance 'runtime'. Global and workspace checks merge by id (workspace wins); workspace checks are honoured only for trusted workspaces and ignored with a warning otherwise.",
      "type": "object",
      "propertyNames": { "pattern": "^[a-z0-9][a-z0-9._-]*$" },
      "additionalProperties": { "$ref": "#/$defs/check" }
    },
    "trustedWorkspaces": {
      "description": "Read from the global file only (ignored with a warning in a workspace file). A listed workspace (absolute path, compared after symlink resolution) may define providers, checks and agents in its own lumencortex.json; any other workspace may only set model, failover, effort (including effort.auto.model, which must name a model of a global provider) and the models and effort of existing agents, and only to models of global providers.",
      "type": "array",
      "items": {
        "type": "string",
        "pattern": "^(/|[A-Za-z]:[\\\\/])"
      },
      "uniqueItems": true
    }
  },
  "$defs": {
    "modelRef": {
      "description": "provider/model: provider id and model key, exactly one '/'.",
      "type": "string",
      "pattern": "^[^/]+/[^/]+$"
    },
    "effort": {
      "description": "Provider-neutral reasoning effort level.",
      "enum": ["none", "low", "medium", "high", "max"]
    },
    "agent": {
      "description": "One agent. Absent fields keep the built-in's fixed value or the custom default.",
      "type": "object",
      "additionalProperties": false,
      "properties": {
        "name": {
          "description": "Display name, unique regardless of case. Absent → the id.",
          "type": "string",
          "minLength": 1,
          "maxLength": 40
        },
        "description": {
          "description": "When to use the agent. The model selects delegation agents by this text, so it is required for them. At most 280 bytes.",
          "type": "string",
          "maxLength": 280
        },
        "use": {
          "description": "conversation: runs threads the user starts; delegation: runs only as a child (spawn_subagent when policy is read-only, start_task when workspace); both. Absent → conversation.",
          "enum": ["conversation", "delegation", "both"]
        },
        "policy": {
          "description": "Ceiling of the run's tool policy: the run gets the lower of the grant and this. Absent → full (no cap). An agent used for delegation must set read-only or workspace.",
          "enum": ["read-only", "workspace", "full"]
        },
        "delegation": {
          "description": "Ceiling of a conversation's start_task grant: none, propose or isolated. Absent → isolated (no cap). Not allowed for delegation-only agents: children never delegate.",
          "enum": ["none", "propose", "isolated"]
        },
        "instructions": {
          "description": "Plain text appended as the last system message of every request the agent makes. It cannot change tools, policy or delegation. At most 16 KiB.",
          "type": "string",
          "maxLength": 16384
        },
        "effort": {
          "description": "Default effort of every candidate without its own. Absent → effort.default. A thread's per-run override still wins; children never inherit it.",
          "$ref": "#/$defs/effortRequest"
        },
        "models": {
          "description": "Ordered model candidates: the first is the model a new session pins, the rest are tried in order after the pinned model under the failover rules. Absent → inherit: conversations use model + failover, children their parent's effective list.",
          "type": "array",
          "minItems": 1,
          "maxItems": 8,
          "items": { "$ref": "#/$defs/agentModel" }
        }
      }
    },
    "agentModel": {
      "type": "object",
      "additionalProperties": false,
      "required": ["model"],
      "properties": {
        "model": { "$ref": "#/$defs/modelRef" },
        "effort": {
          "description": "Effort for this candidate. Absent → the agent's effort, then effort.default.",
          "$ref": "#/$defs/effortRequest"
        }
      }
    },
    "effortRequest": {
      "description": "Effort request: a concrete level, or \"auto\" to classify each user turn before the first request.",
      "enum": ["none", "low", "medium", "high", "max", "auto"]
    },
    "provider": {
      "type": "object",
      "additionalProperties": false,
      "properties": {
        "name": {
          "description": "Display name. Absent → the provider id is shown.",
          "type": "string"
        },
        "package": {
          "description": "Wire protocol. openai-compatible (absent, empty and the legacy ids included) selects the chat-completions client; anthropic-messages selects the Anthropic Messages client.",
          "enum": ["", "openai-compatible", "anthropic-messages", "@opencode/ai/providers/openai-compatible", "@ai-sdk/openai-compatible"]
        },
        "settings": {
          "description": "Connection settings for the provider client.",
          "type": "object",
          "additionalProperties": false,
          "properties": {
            "baseURL": {
              "description": "API base URL; core appends the package's path when endpoint is absent (/chat/completions for openai-compatible, /v1/messages for anthropic-messages). Either baseURL or endpoint is required to run a model: there is no default URL, and a model whose provider has neither is refused before any request.",
              "type": "string",
              "pattern": "^https?://"
            },
            "endpoint": {
              "description": "Full chat completions URL; when set it wins over baseURL.",
              "type": "string",
              "pattern": "^https?://"
            },
            "apiKey": {
              "description": "Credential reference: {env:VAR_NAME} reads the process environment, {secret:NAME} is resolved by the host's credential store (Core's CredentialResolver); core resolves it when a provider client is built. Literal keys are invalid.",
              "type": "string",
              "pattern": "^\\{(env:[A-Za-z_][A-Za-z0-9_]*|secret:[A-Za-z0-9][A-Za-z0-9._-]{0,127})\\}$"
            },
            "headers": {
              "description": "Extra HTTP headers sent with every request (e.g. OpenRouter HTTP-Referer/X-Title).",
              "type": "object",
              "maxProperties": 16,
              "additionalProperties": { "type": "string" }
            },
            "timeoutSeconds": {
              "description": "Whole-request cap in seconds. Absent → no cap; the idle timeout and run cancellation bound the request.",
              "type": "integer",
              "minimum": 1,
              "maximum": 3600
            },
            "idleTimeoutSeconds": {
              "description": "Abort when no response bytes arrive for this many seconds (waiting for headers or between stream chunks); counts as an availability error. Absent → 120.",
              "type": "integer",
              "minimum": 1,
              "maximum": 600
            }
          }
        },
        "models": {
          "description": "Models keyed by model key (the part after '/' in a model ref).",
          "type": "object",
          "propertyNames": { "pattern": "^[^/]+$" },
          "additionalProperties": { "$ref": "#/$defs/model" }
        }
      }
    },
    "model": {
      "type": "object",
      "additionalProperties": false,
      "properties": {
        "name": {
          "description": "Display name. Absent → the model key is shown.",
          "type": "string"
        },
        "modelID": {
          "description": "Upstream model id sent in the request 'model' field. Absent → the model key is sent.",
          "type": "string",
          "minLength": 1
        },
        "limit": {
          "description": "Token limits used by the context window builder. Absent → runtime uses context 32768 / output 4096 and logs a warning.",
          "type": "object",
          "additionalProperties": false,
          "properties": {
            "context": {
              "description": "Context window in tokens. Absent → 32768 with a warning.",
              "type": "integer",
              "minimum": 1
            },
            "output": {
              "description": "Maximum output tokens reserved per request. Absent → 4096 with a warning.",
              "type": "integer",
              "minimum": 1
            }
          }
        },
        "reasoning": {
          "description": "How effort is sent and how reasoning output is handled. Absent → format none: no reasoning parameter is sent.",
          "type": "object",
          "additionalProperties": false,
          "properties": {
            "format": {
              "description": "Request encoding of effort: none (never sent), reasoning-object ({reasoning:{effort}}), reasoning-effort (reasoning_effort field), deepseek (DeepSeek thinking parameters).",
              "enum": ["none", "reasoning-object", "reasoning-effort", "deepseek"]
            },
            "efforts": {
              "description": "Effort levels the model accepts. A requested effort is raised to the lowest listed level not below it, or lowered to the highest listed level when the request is above all of them. Absent → the effort is passed to reasoning.format unchanged.",
              "type": "array",
              "items": { "$ref": "#/$defs/effort" },
              "uniqueItems": true
            },
            "echo": {
              "description": "reasoning_content: the adapter keeps the reasoning_content the model returns in run memory and sends it back with that model's assistant messages of the current tool turn (required by DeepSeek thinking mode with tools). It is never stored. none: the field is never sent back, for providers that reject it. Absent → reasoning_content when format is deepseek, otherwise none.",
              "enum": ["none", "reasoning_content"]
            }
          }
        },
        "toolCalling": {
          "description": "Whether the model accepts tool specs. Agent runs always send tools, so models with false are never chosen as session, subagent or failover model. Default true.",
          "type": "boolean"
        },
        "modalities": {
          "description": "Accepted input modalities. Absent → text only. Core never sends image parts to a model that does not list image.",
          "type": "object",
          "additionalProperties": false,
          "properties": {
            "input": {
              "description": "Input modalities the model accepts.",
              "type": "array",
              "items": { "enum": ["text", "image"] },
              "uniqueItems": true,
              "minItems": 1
            }
          }
        }
      }
    },
    "check": {
      "type": "object",
      "additionalProperties": false,
      "required": ["kind"],
      "properties": {
        "kind": {
          "description": "test/build run command in the workspace and pass on exit 0; schema validates files against schema.",
          "enum": ["test", "build", "schema"]
        },
        "command": {
          "description": "Shell command run from the workspace root (test/build).",
          "type": "string",
          "minLength": 1
        },
        "schema": {
          "description": "Workspace-relative path of the JSON Schema used by a schema check.",
          "type": "string"
        },
        "files": {
          "description": "Workspace-relative files validated by a schema check.",
          "type": "array",
          "items": { "type": "string" },
          "minItems": 1
        },
        "timeoutSeconds": {
          "description": "Kill the check after this many seconds and record status error. Default 600.",
          "type": "integer",
          "minimum": 1,
          "maximum": 3600
        },
        "required": {
          "description": "Whether a failing result blocks completion of the work unit. Default true.",
          "type": "boolean"
        }
      },
      "if": {
        "properties": { "kind": { "const": "schema" } }
      },
      "then": { "properties": { "schema": true, "files": true }, "required": ["schema", "files"] },
      "else": { "properties": { "command": true }, "required": ["command"] }
    }
  }
}
